{
  "configuration": {
    "categories": [],
    "engines": [
      "languagetool",
      "vale"
    ],
    "llm_provider": "llama_cpp",
    "sources": {
      "categories": "по умолчанию",
      "engines": "файл конфигурации",
      "llm.provider": "по умолчанию"
    }
  },
  "coordinate_system": {
    "byte_offset": "смещение в байтах исходного файла от нуля, включая BOM",
    "column": "столбец в Unicode code points от единицы; табуляция — один code point",
    "end": "exclusive",
    "line": "номер физической строки от единицы",
    "utf16_column": "столбец в UTF-16 code units от единицы"
  },
  "documents": [
    {
      "bom": "utf-8",
      "configuration": {
        "categories": [],
        "engines": [
          "languagetool",
          "vale"
        ],
        "sources": {
          "categories": "по умолчанию",
          "engines": "файл конфигурации",
          "terms": "по умолчанию"
        },
        "terms_count": 0
      },
      "diagnostics": [],
      "encoding": "utf-8",
      "extraction_reason": null,
      "extraction_status": "extracted",
      "findings": [
        {
          "agreement": [
            "languagetool"
          ],
          "categories": [
            "spelling"
          ],
          "category": "spelling",
          "conflicting_suggestions": false,
          "excerpt": "ошыбок",
          "excerpt_status": "verified",
          "fragment_ids": [
            "frag-d97ad56d14a42b3599e29417"
          ],
          "id": "find-b6ed36874fdc336634447b78",
          "range": {
            "end": {
              "byte_offset": 109,
              "column": 23,
              "line": 4,
              "utf16_column": 23
            },
            "start": {
              "byte_offset": 97,
              "column": 17,
              "line": 4,
              "utf16_column": 17
            }
          },
          "sources": [
            {
              "category": "spelling",
              "confidence": null,
              "engine": "languagetool",
              "engine_excerpt": "ошыбок",
              "message": "Возможно найдена орфографическая ошибка.",
              "range": {
                "end": {
                  "byte_offset": 109,
                  "column": 23,
                  "line": 4,
                  "utf16_column": 23
                },
                "start": {
                  "byte_offset": 97,
                  "column": 17,
                  "line": 4,
                  "utf16_column": 17
                }
              },
              "rule_category": "TYPOS",
              "rule_id": "MORFOLOGIK_RULE_RU_RU",
              "severity": null
            }
          ],
          "suggestions": [
            {
              "edit": {
                "original": "ошыбок",
                "range": {
                  "end": {
                    "byte_offset": 109,
                    "column": 23,
                    "line": 4,
                    "utf16_column": 23
                  },
                  "start": {
                    "byte_offset": 97,
                    "column": 17,
                    "line": 4,
                    "utf16_column": 17
                  }
                },
                "text": "ошибок"
              },
              "engine_replacement": "ошибок",
              "engines": [
                "languagetool"
              ],
              "origin": "dictionary",
              "reasons": [],
              "status": "candidate"
            }
          ]
        },
        {
          "agreement": [
            "vale"
          ],
          "categories": [
            "bureaucratese"
          ],
          "category": "bureaucratese",
          "conflicting_suggestions": false,
          "excerpt": "осуществляется",
          "excerpt_status": "verified",
          "fragment_ids": [
            "frag-f552921cc137d2c0c8926621"
          ],
          "id": "find-1edd2738ccb5edf16b479bba",
          "range": {
            "end": {
              "byte_offset": 229,
              "column": 25,
              "line": 6,
              "utf16_column": 25
            },
            "start": {
              "byte_offset": 201,
              "column": 11,
              "line": 6,
              "utf16_column": 11
            }
          },
          "sources": [
            {
              "category": "bureaucratese",
              "confidence": null,
              "engine": "vale",
              "engine_excerpt": "осуществляется",
              "message": "Канцелярит: «осуществляется» — попробуйте выразить проще.",
              "range": {
                "end": {
                  "byte_offset": 229,
                  "column": 25,
                  "line": 6,
                  "utf16_column": 25
                },
                "start": {
                  "byte_offset": 201,
                  "column": 11,
                  "line": 6,
                  "utf16_column": 11
                }
              },
              "rule_category": "LanguageReview",
              "rule_id": "LanguageReview.Bureaucratese",
              "severity": "suggestion"
            }
          ],
          "suggestions": []
        },
        {
          "agreement": [
            "vale"
          ],
          "categories": [
            "bureaucratese"
          ],
          "category": "bureaucratese",
          "conflicting_suggestions": false,
          "excerpt": "посредством",
          "excerpt_status": "verified",
          "fragment_ids": [
            "frag-f552921cc137d2c0c8926621"
          ],
          "id": "find-6dcc94d531a2bf5501f4e58c",
          "range": {
            "end": {
              "byte_offset": 252,
              "column": 37,
              "line": 6,
              "utf16_column": 37
            },
            "start": {
              "byte_offset": 230,
              "column": 26,
              "line": 6,
              "utf16_column": 26
            }
          },
          "sources": [
            {
              "category": "bureaucratese",
              "confidence": null,
              "engine": "vale",
              "engine_excerpt": "посредством",
              "message": "Канцелярит: «посредством» — попробуйте выразить проще.",
              "range": {
                "end": {
                  "byte_offset": 252,
                  "column": 37,
                  "line": 6,
                  "utf16_column": 37
                },
                "start": {
                  "byte_offset": 230,
                  "column": 26,
                  "line": 6,
                  "utf16_column": 26
                }
              },
              "rule_category": "LanguageReview",
              "rule_id": "LanguageReview.Bureaucratese",
              "severity": "suggestion"
            }
          ],
          "suggestions": []
        }
      ],
      "format": "markdown",
      "fragments": [
        {
          "checks": {
            "languagetool": {
              "reason": null,
              "status": "checked"
            },
            "vale": {
              "reason": null,
              "status": "checked"
            }
          },
          "context": "markdown:h1",
          "id": "frag-fcf0402d87d5fd7110c7078d",
          "kind": "markdown_prose",
          "range": {
            "end": {
              "byte_offset": 23,
              "column": 12,
              "line": 1,
              "utf16_column": 12
            },
            "start": {
              "byte_offset": 5,
              "column": 3,
              "line": 1,
              "utf16_column": 3
            }
          },
          "unit_fragment_ids": [
            "frag-fcf0402d87d5fd7110c7078d"
          ]
        },
        {
          "checks": {
            "languagetool": {
              "reason": null,
              "status": "checked"
            },
            "vale": {
              "reason": null,
              "status": "checked"
            }
          },
          "context": "markdown:prose",
          "id": "frag-c0c7861381151c41b8d38b0d",
          "kind": "markdown_prose",
          "range": {
            "end": {
              "byte_offset": 65,
              "column": 21,
              "line": 3,
              "utf16_column": 21
            },
            "start": {
              "byte_offset": 27,
              "column": 1,
              "line": 3,
              "utf16_column": 1
            }
          },
          "unit_fragment_ids": [
            "frag-c0c7861381151c41b8d38b0d",
            "frag-d97ad56d14a42b3599e29417"
          ]
        },
        {
          "checks": {
            "languagetool": {
              "reason": null,
              "status": "checked"
            },
            "vale": {
              "reason": null,
              "status": "checked"
            }
          },
          "context": "markdown:prose",
          "id": "frag-d97ad56d14a42b3599e29417",
          "kind": "markdown_prose",
          "range": {
            "end": {
              "byte_offset": 178,
              "column": 69,
              "line": 4,
              "utf16_column": 69
            },
            "start": {
              "byte_offset": 67,
              "column": 1,
              "line": 4,
              "utf16_column": 1
            }
          },
          "unit_fragment_ids": [
            "frag-c0c7861381151c41b8d38b0d",
            "frag-d97ad56d14a42b3599e29417"
          ]
        },
        {
          "checks": {
            "languagetool": {
              "reason": null,
              "status": "checked"
            },
            "vale": {
              "reason": null,
              "status": "checked"
            }
          },
          "context": "markdown:prose",
          "id": "frag-f552921cc137d2c0c8926621",
          "kind": "markdown_prose",
          "range": {
            "end": {
              "byte_offset": 278,
              "column": 58,
              "line": 6,